{"difficulty":9,"questionType":"short_story","mechanic":"raise_board","skill":"listening","promptText":"How many grapes does Pip have?","audioText":"Pip has a pink bird. The bird likes bread. Pip has 5 grapes. They are at school.","stimulus":{"type":"story","text":"Pip has a pink bird. The bird likes bread. Pip has 5 grapes. They are at school.","character":"Pip"},"options":[{"id":"A","label":"3"},{"id":"B","label":"2"},{"id":"C","label":"1"},{"id":"D","label":"5"}],"answer":{"type":"option","value":"D"},"hint":{"afterWrong":1,"text":"Listen to the story one more time.","strategy":"replay_story"},"explanation":"The story says 5.","targetVocabulary":["bird","pink","bread","grape","5","school"],"worldTags":["story"],"estimatedSeconds":24,"requiresMemoryPhase":false,"notes":"","id":"GB-0831"}