{"difficulty":3,"questionType":"preposition_scene","mechanic":"answer_zone","skill":"sentence_comprehension","promptText":"Choose the picture: The dog is under the box.","audioText":"The dog is under the box.","stimulus":{"type":"sceneChoices"},"options":[{"id":"A","label":"dog on box","scene":{"animal":"dog","object":"box","relation":"on"}},{"id":"B","label":"dog in box","scene":{"animal":"dog","object":"box","relation":"in"}},{"id":"C","label":"dog under box","scene":{"animal":"dog","object":"box","relation":"under"}}],"answer":{"type":"option","value":"C"},"hint":{"afterWrong":2,"text":"Listen to the position word: under.","strategy":"animate_relation"},"explanation":"The dog is under the box.","targetVocabulary":["dog","box","under"],"worldTags":["prepositions","animals"],"estimatedSeconds":14,"requiresMemoryPhase":false,"notes":"","id":"GB-0252"}