{"difficulty":5,"questionType":"missing_letter","mechanic":"raise_board","skill":"spelling","promptText":"Complete the word: C A _","audioText":"Complete the word car.","stimulus":{"type":"word","maskedWord":"C A _","meaningAssetKey":"vocab_car"},"options":[{"id":"A","label":"M"},{"id":"B","label":"R"},{"id":"C","label":"S"},{"id":"D","label":"Z"}],"answer":{"type":"option","value":"B"},"hint":{"afterWrong":2,"text":"Listen: car.","strategy":"play_word_slow"},"explanation":"The word is CAR.","targetVocabulary":["car"],"worldTags":["spelling"],"estimatedSeconds":12,"requiresMemoryPhase":false,"notes":"","id":"GB-0434"}