{"difficulty":7,"questionType":"sentence_order","mechanic":"quick_match","skill":"reading","promptText":"Put the words in the correct order.","audioText":"Put the words in the correct order.","stimulus":{"type":"wordTiles","tiles":["DOG","CAN","RUN","THE"]},"options":[],"answer":{"type":"sequence","value":["THE","DOG","CAN","RUN"]},"hint":{"afterWrong":2,"text":"Start with the word that begins the sentence.","strategy":"pulse_first_word"},"explanation":"The dog can run.","targetVocabulary":["the","dog","can","run"],"worldTags":["reading","sentence"],"estimatedSeconds":18,"requiresMemoryPhase":false,"notes":"","id":"GB-0673"}