{"difficulty":9,"questionType":"short_story","mechanic":"raise_board","skill":"listening","promptText":"How many apples does Foxy have?","audioText":"Foxy has a purple dog. The dog likes potato. Foxy has 5 apples. They are in the garden.","stimulus":{"type":"story","text":"Foxy has a purple dog. The dog likes potato. Foxy has 5 apples. They are in the garden.","character":"Foxy"},"options":[{"id":"A","label":"2"},{"id":"B","label":"1"},{"id":"C","label":"6"},{"id":"D","label":"5"}],"answer":{"type":"option","value":"D"},"hint":{"afterWrong":1,"text":"Listen to the story one more time.","strategy":"replay_story"},"explanation":"The story says 5.","targetVocabulary":["dog","purple","potato","apple","5","garden"],"worldTags":["story"],"estimatedSeconds":24,"requiresMemoryPhase":false,"notes":"","id":"GB-0856"}