{"difficulty":1,"questionType":"shape_recognition","mechanic":"answer_zone","skill":"vocabulary","promptText":"Find the HEART.","audioText":"Find the heart.","stimulus":{"type":"shapeSet"},"options":[{"id":"A","label":"rectangle","assetKey":"shape_rectangle","emoji":"▭"},{"id":"B","label":"square","assetKey":"shape_square","emoji":"🟦"},{"id":"C","label":"star","assetKey":"shape_star","emoji":"⭐"},{"id":"D","label":"heart","assetKey":"shape_heart","emoji":"❤️"}],"answer":{"type":"option","value":"D"},"hint":{"afterWrong":2,"text":"Look for the heart.","strategy":"outline_hint"},"explanation":"This shape is a heart.","targetVocabulary":["heart"],"worldTags":["shapes"],"estimatedSeconds":8,"requiresMemoryPhase":false,"notes":"","id":"GB-0076"}