{"difficulty":6,"questionType":"missing_letter","mechanic":"raise_board","skill":"spelling","promptText":"Complete the word: _ O W","audioText":"Complete the word cow.","stimulus":{"type":"word","maskedWord":"_ O W","meaningAssetKey":"vocab_cow"},"options":[{"id":"A","label":"C"},{"id":"B","label":"S"},{"id":"C","label":"X"},{"id":"D","label":"U"}],"answer":{"type":"option","value":"A"},"hint":{"afterWrong":2,"text":"Listen: cow.","strategy":"play_word_slow"},"explanation":"The word is COW.","targetVocabulary":["cow"],"worldTags":["spelling"],"estimatedSeconds":12,"requiresMemoryPhase":false,"notes":"","id":"GB-0560"}