{"difficulty":6,"questionType":"can_cannot","mechanic":"bell_choice","skill":"meaning","promptText":"Which one can jump?","audioText":"Which one can jump?","stimulus":{"type":"none"},"options":[{"id":"A","label":"FROG","assetKey":"vocab_frog"},{"id":"B","label":"BUS","assetKey":"vocab_bus"},{"id":"C","label":"CHAIR","assetKey":"vocab_chair"},{"id":"D","label":"BOOK","assetKey":"vocab_book"}],"answer":{"type":"option","value":"A"},"hint":{"afterWrong":2,"text":"Listen carefully to can.","strategy":"emphasize_modal"},"explanation":"frog can jump.","targetVocabulary":["frog","jump"],"worldTags":["actions"],"estimatedSeconds":14,"requiresMemoryPhase":false,"notes":"","id":"GB-0538"}