{"difficulty":10,"questionType":"final_reasoning","mechanic":"bell_choice","skill":"reasoning","promptText":"Pip is wearing a coat and holding an umbrella. What is the weather probably like?","audioText":"Pip is wearing a coat and holding an umbrella. What is the weather probably like?","stimulus":{"type":"finalReasoningScene"},"options":[{"id":"A","label":"RAINY"},{"id":"B","label":"HOT"},{"id":"C","label":"SUNNY"},{"id":"D","label":"WINDY"}],"answer":{"type":"option","value":"A"},"hint":{"afterWrong":1,"text":"Listen again and use all the clues.","strategy":"replay_in_chunks"},"explanation":"A coat and umbrella are clues for rainy weather.","targetVocabulary":["coat","umbrella","rainy"],"worldTags":["final_bell","reasoning"],"estimatedSeconds":22,"requiresMemoryPhase":false,"notes":"","id":"GB-0955"}