{"difficulty":2,"questionType":"count_objects","mechanic":"bell_choice","skill":"counting","promptText":"How many dogs are there?","audioText":"How many dogs are there?","stimulus":{"type":"scene","objects":[{"assetKey":"animals_dog","count":4,"color":null}],"description":"4 dogs"},"options":[{"id":"A","label":"5"},{"id":"B","label":"4"},{"id":"C","label":"7"},{"id":"D","label":"6"}],"answer":{"type":"option","value":"B"},"hint":{"afterWrong":2,"text":"Count slowly: one, two, three...","strategy":"count_bounce"},"explanation":"There are 4 dogs.","targetVocabulary":["dog","4"],"worldTags":["numbers"],"estimatedSeconds":10,"requiresMemoryPhase":false,"notes":"","id":"GB-0174"}