{"difficulty":7,"questionType":"select_pair","mechanic":"quick_match","skill":"listening","promptText":"Choose the pair: chicken and apple.","audioText":"Choose the pair: chicken and apple.","stimulus":{"type":"pairGrid"},"options":[{"id":"A","label":"chicken + apple","assets":["animals_chicken","food_apple"]},{"id":"B","label":"duck + banana","assets":["animals_duck","food_banana"]},{"id":"C","label":"tiger + rice","assets":["animals_tiger","food_rice"]},{"id":"D","label":"bird + apple","assets":["animals_bird","food_apple"]}],"answer":{"type":"option","value":"A"},"hint":{"afterWrong":2,"text":"Find BOTH words from the sentence.","strategy":"repeat_pair_words"},"explanation":"The pair is chicken and apple.","targetVocabulary":["chicken","apple"],"worldTags":["mixed"],"estimatedSeconds":14,"requiresMemoryPhase":false,"notes":"","id":"GB-0699"}