{"difficulty":5,"questionType":"compare_quantity","mechanic":"answer_zone","skill":"counting","promptText":"Which group has MORE ducks?","audioText":"Which group has MORE ducks?","stimulus":{"type":"twoGroups","item":"duck","a":4,"b":5},"options":[{"id":"A","label":"4 ducks","count":4,"assetKey":"vocab_duck"},{"id":"B","label":"5 ducks","count":5,"assetKey":"vocab_duck"}],"answer":{"type":"option","value":"B"},"hint":{"afterWrong":2,"text":"Count each group slowly.","strategy":"count_bounce"},"explanation":"Group B has the requested amount.","targetVocabulary":["duck","more"],"worldTags":["numbers"],"estimatedSeconds":14,"requiresMemoryPhase":false,"notes":"","id":"GB-0428"}