{"difficulty":4,"questionType":"two_attribute_object","mechanic":"answer_zone","skill":"listening","promptText":"Find the big white star.","audioText":"Find the big white star.","stimulus":{"type":"attributeObjects"},"options":[{"id":"A","label":"small white star","assetKey":"object_star","displayColor":"white","size":"small"},{"id":"B","label":"big purple star","assetKey":"object_star","displayColor":"purple","size":"big"},{"id":"C","label":"big white star","assetKey":"object_star","displayColor":"white","size":"big"},{"id":"D","label":"small purple star","assetKey":"object_star","displayColor":"purple","size":"small"}],"answer":{"type":"option","value":"C"},"hint":{"afterWrong":2,"text":"Look for BOTH: big and white.","strategy":"highlight_prompt_words"},"explanation":"The answer must be big and white.","targetVocabulary":["big","white","star"],"worldTags":["colors","adjectives"],"estimatedSeconds":12,"requiresMemoryPhase":false,"notes":"","id":"GB-0381"}