{"difficulty":10,"questionType":"short_story","mechanic":"raise_board","skill":"listening","promptText":"What does the bird like?","audioText":"Lulu has a pink bird. The bird likes apple. Lulu has 4 pears. They are at school.","stimulus":{"type":"story","text":"Lulu has a pink bird. The bird likes apple. Lulu has 4 pears. They are at school.","character":"Lulu"},"options":[{"id":"A","label":"APPLE"},{"id":"B","label":"POTATO"},{"id":"C","label":"RICE"},{"id":"D","label":"EGG"}],"answer":{"type":"option","value":"A"},"hint":{"afterWrong":1,"text":"Listen to the story one more time.","strategy":"replay_story"},"explanation":"The story says apple.","targetVocabulary":["bird","pink","apple","pear","4","school"],"worldTags":["story"],"estimatedSeconds":24,"requiresMemoryPhase":false,"notes":"","id":"GB-0949"}