{"difficulty":3,"questionType":"odd_one_out","mechanic":"bell_choice","skill":"categorization","promptText":"Which one is NOT an animal?","audioText":"Which one is NOT an animal?","stimulus":{"type":"objectRow"},"options":[{"id":"A","label":"tiger","assetKey":"animals_tiger","emoji":"🐯"},{"id":"B","label":"rabbit","assetKey":"animals_rabbit","emoji":"🐰"},{"id":"C","label":"apple","assetKey":"food_apple","emoji":"🍎"},{"id":"D","label":"dog","assetKey":"animals_dog","emoji":"🐶"}],"answer":{"type":"option","value":"C"},"hint":{"afterWrong":2,"text":"Three belong together. One is different.","strategy":"group_three"},"explanation":"apple belongs to food, not animals.","targetVocabulary":["rabbit","dog","tiger","apple"],"worldTags":["animals","food"],"estimatedSeconds":12,"requiresMemoryPhase":false,"notes":"","id":"GB-0214"}