{"difficulty":1,"questionType":"color_recognition","mechanic":"answer_zone","skill":"vocabulary","promptText":"Find PURPLE.","audioText":"Find purple.","stimulus":{"type":"colorSwatches"},"options":[{"id":"A","label":"ORANGE","assetKey":"color_orange"},{"id":"B","label":"BLACK","assetKey":"color_black"},{"id":"C","label":"PURPLE","assetKey":"color_purple"},{"id":"D","label":"GREEN","assetKey":"color_green"}],"answer":{"type":"option","value":"C"},"hint":{"afterWrong":2,"text":"Find the purple color.","strategy":"soft_glow"},"explanation":"The correct color is purple.","targetVocabulary":["purple"],"worldTags":["colors"],"estimatedSeconds":8,"requiresMemoryPhase":false,"notes":"","id":"GB-0087"}