{"difficulty":8,"questionType":"can_cannot","mechanic":"bell_choice","skill":"meaning","promptText":"Find one that cannot run.","audioText":"Find one that cannot run.","stimulus":{"type":"none"},"options":[{"id":"A","label":"HORSE","assetKey":"vocab_horse"},{"id":"B","label":"BUS","assetKey":"vocab_bus"},{"id":"C","label":"DOG","assetKey":"vocab_dog"},{"id":"D","label":"RABBIT","assetKey":"vocab_rabbit"}],"answer":{"type":"option","value":"B"},"hint":{"afterWrong":2,"text":"Listen carefully to cannot.","strategy":"emphasize_modal"},"explanation":"bus cannot run.","targetVocabulary":["bus","run"],"worldTags":["actions"],"estimatedSeconds":14,"requiresMemoryPhase":false,"notes":"","id":"GB-0744"}