{"difficulty":5,"questionType":"select_pair","mechanic":"quick_match","skill":"listening","promptText":"Choose the pair: cow and cake.","audioText":"Choose the pair: cow and cake.","stimulus":{"type":"pairGrid"},"options":[{"id":"A","label":"duck + cake","assets":["animals_duck","food_cake"]},{"id":"B","label":"fish + milk","assets":["animals_fish","food_milk"]},{"id":"C","label":"cow + cake","assets":["animals_cow","food_cake"]},{"id":"D","label":"dog + rice","assets":["animals_dog","food_rice"]}],"answer":{"type":"option","value":"C"},"hint":{"afterWrong":2,"text":"Find BOTH words from the sentence.","strategy":"repeat_pair_words"},"explanation":"The pair is cow and cake.","targetVocabulary":["cow","cake"],"worldTags":["mixed"],"estimatedSeconds":14,"requiresMemoryPhase":false,"notes":"","id":"GB-0435"}