{"difficulty":10,"questionType":"short_story","mechanic":"raise_board","skill":"listening","promptText":"Where are Poki and the frog?","audioText":"Poki has a pink frog. The frog likes cake. Poki has 2 cookies. They are at home.","stimulus":{"type":"story","text":"Poki has a pink frog. The frog likes cake. Poki has 2 cookies. They are at home.","character":"Poki"},"options":[{"id":"A","label":"HOME"},{"id":"B","label":"SCHOOL"},{"id":"C","label":"PARK"},{"id":"D","label":"GARDEN"}],"answer":{"type":"option","value":"A"},"hint":{"afterWrong":1,"text":"Listen to the story one more time.","strategy":"replay_story"},"explanation":"The story says home.","targetVocabulary":["frog","pink","cake","cookie","2","home"],"worldTags":["story"],"estimatedSeconds":24,"requiresMemoryPhase":false,"notes":"","id":"GB-0929"}