{"difficulty":8,"questionType":"multi_clue_scene","mechanic":"answer_zone","skill":"sentence_comprehension","promptText":"Find the small red rabbit on the box.","audioText":"Find the small red rabbit on the box.","stimulus":{"type":"sceneChoices"},"options":[{"id":"A","label":"small red rabbit under box","scene":{"animal":"rabbit","color":"red","size":"small","relation":"under","object":"box"}},{"id":"B","label":"big red cat next to box","scene":{"animal":"cat","color":"red","size":"big","relation":"next to","object":"box"}},{"id":"C","label":"small purple rabbit behind box","scene":{"animal":"rabbit","color":"purple","size":"small","relation":"behind","object":"box"}},{"id":"D","label":"small red rabbit on box","scene":{"animal":"rabbit","color":"red","size":"small","relation":"on","object":"box"}}],"answer":{"type":"option","value":"D"},"hint":{"afterWrong":2,"text":"Remember all clues: small, red, rabbit, on.","strategy":"highlight_clues_sequentially"},"explanation":"The correct picture matches all four clues.","targetVocabulary":["small","red","rabbit","on","box"],"worldTags":["prepositions"],"estimatedSeconds":18,"requiresMemoryPhase":false,"notes":"","id":"GB-0790"}