{"difficulty":2,"questionType":"listen_find_picture","mechanic":"listen_run","skill":"listening","promptText":"Listen and find: PLATE.","audioText":"Find the plate.","stimulus":{"type":"none"},"options":[{"id":"A","label":"lamp","assetKey":"home_lamp","emoji":"💡"},{"id":"B","label":"plate","assetKey":"home_plate","emoji":"🍽️"},{"id":"C","label":"table","assetKey":"home_table"},{"id":"D","label":"clock","assetKey":"home_clock","emoji":"🕒"}],"answer":{"type":"option","value":"B"},"hint":{"afterWrong":2,"text":"Listen again: plate.","strategy":"pulse_correct_asset"},"explanation":"The correct answer is plate.","targetVocabulary":["plate"],"worldTags":["home"],"estimatedSeconds":8,"requiresMemoryPhase":false,"notes":"","id":"GB-0106"}