{"difficulty":7,"questionType":"sentence_order","mechanic":"quick_match","skill":"reading","promptText":"Put the words in the correct order.","audioText":"Put the words in the correct order.","stimulus":{"type":"wordTiles","tiles":["MOMO","TWO","BOOKS","HAS"]},"options":[],"answer":{"type":"sequence","value":["MOMO","HAS","TWO","BOOKS"]},"hint":{"afterWrong":2,"text":"Start with the word that begins the sentence.","strategy":"pulse_first_word"},"explanation":"Momo has two books.","targetVocabulary":["momo","has","two","books"],"worldTags":["reading","sentence"],"estimatedSeconds":18,"requiresMemoryPhase":false,"notes":"","id":"GB-0603"}