{"difficulty":5,"questionType":"select_pair","mechanic":"quick_match","skill":"listening","promptText":"Choose the pair: bird and water.","audioText":"Choose the pair: bird and water.","stimulus":{"type":"pairGrid"},"options":[{"id":"A","label":"bird + water","assets":["animals_bird","food_water"]},{"id":"B","label":"horse + water","assets":["animals_horse","food_water"]},{"id":"C","label":"fish + egg","assets":["animals_fish","food_egg"]},{"id":"D","label":"bird + egg","assets":["animals_bird","food_egg"]}],"answer":{"type":"option","value":"A"},"hint":{"afterWrong":2,"text":"Find BOTH words from the sentence.","strategy":"repeat_pair_words"},"explanation":"The pair is bird and water.","targetVocabulary":["bird","water"],"worldTags":["mixed"],"estimatedSeconds":14,"requiresMemoryPhase":false,"notes":"","id":"GB-0490"}