{"difficulty":4,"questionType":"two_attribute_object","mechanic":"answer_zone","skill":"listening","promptText":"Find the big brown balloon.","audioText":"Find the big brown balloon.","stimulus":{"type":"attributeObjects"},"options":[{"id":"A","label":"big blue balloon","assetKey":"object_balloon","displayColor":"blue","size":"big"},{"id":"B","label":"big brown balloon","assetKey":"object_balloon","displayColor":"brown","size":"big"},{"id":"C","label":"small brown balloon","assetKey":"object_balloon","displayColor":"brown","size":"small"},{"id":"D","label":"small blue balloon","assetKey":"object_balloon","displayColor":"blue","size":"small"}],"answer":{"type":"option","value":"B"},"hint":{"afterWrong":2,"text":"Look for BOTH: big and brown.","strategy":"highlight_prompt_words"},"explanation":"The answer must be big and brown.","targetVocabulary":["big","brown","balloon"],"worldTags":["colors","adjectives"],"estimatedSeconds":12,"requiresMemoryPhase":false,"notes":"","id":"GB-0361"}